{
  "schema_version": 1,
  "pack_id": "fd2-official-ja",
  "locale": "ja",
  "kind": "official",
  "layout_profile": "pc98-16x16-cjk",
  "font": {"profile": "fd2-cjk-16x16", "path": "fonts/atlas.png"},
  "entries": {
    "battle.attack.miss": {"text": "%s は %s を攻撃したが、外れた", "variables": ["%s", "%s"], "source_string_id": "legacy.go.remake.cmd.fd2.main.l5973-c22"},
    "battle.attack.hit": {"text": "%s は %s を攻撃し、%d のダメージ", "variables": ["%s", "%s", "%d"], "source_string_id": "legacy.go.remake.cmd.fd2.main.l5975-c25"},
    "battle.attack.critical_suffix": {"text": "、クリティカル", "variables": [], "source_string_id": "legacy.go.remake.cmd.fd2.main.l5977-c14"},
    "battle.attack.exp_suffix": {"text": "、経験値 +%.0f", "variables": ["%.0f"], "source_string_id": "legacy.go.remake.cmd.fd2.main.l5980-c26"},
    "battle.mp.insufficient": {"text": "MPが足りません！", "variables": [], "source_string_id": "legacy.go.remake.cmd.fd2.main.l5091-c14"},
    "battle.command.unavailable": {"text": "このコマンドは使用できません", "variables": [], "source_string_id": "legacy.go.remake.cmd.fd2.main.l5187-c12"},
    "battle.attack.choose_target": {"text": "攻撃：対象を選択", "variables": [], "source_string_id": "legacy.go.remake.cmd.fd2.main.l5193-c13"},
    "battle.command.native_unavailable": {"text": "この原作コマンドは使用できません", "variables": [], "source_string_id": "legacy.go.remake.cmd.fd2.main.l5201-c14"},
    "battle.spell.sealed": {"text": "封印されていて魔法を使えません！", "variables": [], "source_string_id": "legacy.go.remake.cmd.fd2.main.l5211-c14"},
    "battle.spell.none": {"text": "使用できる魔法がありません", "variables": [], "source_string_id": "legacy.go.remake.cmd.fd2.main.l5218-c13"},
    "battle.item.choose_slot": {"text": "道具：スロットを選択", "variables": [], "source_string_id": "legacy.go.remake.cmd.fd2.main.l5225-c13"},
    "battle.item.empty_slot": {"text": "アイテム欄が空です", "variables": [], "source_string_id": "legacy.go.remake.cmd.fd2.main.l5065-c14"},
    "battle.item.data_incomplete": {"text": "アイテムデータが不完全です", "variables": [], "source_string_id": "legacy.go.remake.cmd.fd2.main.l5070-c14"},
    "battle.item.unusable": {"text": "このアイテムは戦場で使えません", "variables": [], "source_string_id": "legacy.go.remake.cmd.fd2.main.l5078-c14"},
    "battle.item.effect_complete": {"text": "アイテム %02Xh：効果が完了しました", "variables": ["%02X"], "source_string_id": "legacy.go.remake.cmd.fd2.main.l5085-c14"},
    "battle.item.choose_target": {"text": "アイテム %02Xh：対象を選択", "variables": ["%02X"], "source_string_id": "legacy.go.remake.cmd.fd2.main.l5092-c14"},
    "battle.item.effect_unverified": {"text": "アイテム %02Xh：効果は未検証です", "variables": ["%02X"], "source_string_id": "legacy.go.remake.cmd.fd2.main.l5095-c14"},
    "battle.item.choose_destination": {"text": "アイテム %02Xh：移動先を選択", "variables": ["%02X"], "source_string_id": "legacy.go.remake.cmd.fd2.main.l6278-c14"},
    "battle.item.damage_presenting": {"text": "アイテム %02Xh：ダメージ演出中", "variables": ["%02X"], "source_string_id": "legacy.go.remake.cmd.fd2.main.l6283-c14"},
    "battle.item.recovery_complete": {"text": "アイテム %02Xh：回復効果が完了しました", "variables": ["%02X"], "source_string_id": "legacy.go.remake.cmd.fd2.main.l6285-c14"},
    "battle.item.relocation_presenting": {"text": "アイテム %02Xh：移動演出中", "variables": ["%02X"], "source_string_id": "legacy.go.remake.cmd.fd2.main.l6297-c14"},
    "battle.item.relocation_complete": {"text": "アイテム %02Xh：移動効果が完了しました", "variables": ["%02X"], "source_string_id": "legacy.go.remake.cmd.fd2.main.l6299-c14"},
    "battle.item.title": {"text": "アイテム　%s", "variables": ["%s"], "source_string_id": "legacy.go.remake.cmd.fd2.main.l8825-c22"},
    "battle.item.empty_label": {"text": "空き", "variables": [], "source_string_id": "legacy.go.remake.cmd.fd2.main.l8830-c13"},
    "battle.spell.target_prompt": {"text": "%s：対象を選択（射程 %d）", "variables": ["%s", "%d"], "source_string_id": "legacy.go.remake.cmd.fd2.main.l5168-c14"},
    "battle.spell.blocked": {"text": "MP不足または封印中です！", "variables": [], "source_string_id": "legacy.go.remake.cmd.fd2.main.l6170-c12"},
    "battle.unit.paralyzed": {"text": "麻痺していて行動できません！", "variables": [], "source_string_id": "legacy.go.remake.cmd.fd2.main.l6145-c12"},
    "battle.spell.result_damage": {"text": "%sは%sを唱えた：%d体に命中（%dダメージ）", "variables": ["%s", "%s", "%d", "%d"], "source_string_id": "legacy.go.remake.cmd.fd2.main.l6194-c10"},
    "battle.spell.result_heal": {"text": "%sは%sを唱えた：%d体に命中（%d回復）", "variables": ["%s", "%s", "%d", "%d"], "source_string_id": "legacy.go.remake.cmd.fd2.main.l6194-c10"},
    "battle.spell.miss_suffix": {"text": "、%d体にミス", "variables": ["%d"], "source_string_id": "legacy.go.remake.cmd.fd2.main.l6196-c13"},
    "battle.treasure.gold": {"text": "%dゴールドを手に入れた", "variables": ["%d"], "source_string_id": "legacy.go.remake.cmd.fd2.main.l5396-c13"},
    "battle.treasure.item": {"text": "アイテム %02Xh を手に入れた", "variables": ["%02X"], "source_string_id": "legacy.go.remake.cmd.fd2.main.l5398-c13"},
    "battle.treasure.inventory_full": {"text": "持ち物がいっぱいなので、宝はその場に残った", "variables": [], "source_string_id": "legacy.go.remake.cmd.fd2.main.l5402-c12"},
    "battle.reward.item": {"text": "敵を倒し、アイテム %02Xh を手に入れた", "variables": ["%02X"], "source_string_id": "legacy.go.remake.cmd.fd2.main.l5457-c12"},
    "battle.reward.item_full": {"text": "持ち物がいっぱいで %02Xh を入手できなかった", "variables": ["%02X"], "source_string_id": "legacy.go.remake.cmd.fd2.main.l5459-c12"},
    "battle.reward.gold": {"text": "敵を倒し、%dゴールドを手に入れた", "variables": ["%d"], "source_string_id": "legacy.go.remake.cmd.fd2.main.l5463-c11"},
    "battle.spell.menu_title": {"text": "魔法  MP %d", "variables": ["%d"], "source_string_id": "legacy.go.remake.cmd.fd2.main.l8687-c22"},
    "church.transfer.empty": {"text": "渡せる物がありません！", "variables": [], "source_string_id": "legacy.go.remake.cmd.fd2.native_church_input.l209-c12"},
    "church.transfer.success": {"text": "アイテム %02Xh を渡しました", "variables": ["%02X"], "source_string_id": "legacy.go.remake.cmd.fd2.native_church_input.l271-c12"},
    "church.revive.success": {"text": "%sが復活しました（-%d G）", "variables": ["%s", "%d"], "source_string_id": "legacy.go.remake.cmd.fd2.main.l4711-c10"},
    "church.class_change.success": {"text": "%sは%sに転職しました", "variables": ["%s", "%s"], "source_string_id": "legacy.go.remake.cmd.fd2.main.l4674-c10"},
    "church.class_change.confirm_title": {"text": "転職しますか？", "variables": [], "source_string_id": "legacy.go.remake.cmd.fd2.main.l9090-c13"},
    "church.class_change.empty": {"text": "条件を満たす仲間がいません", "variables": [], "source_string_id": "legacy.go.remake.cmd.fd2.main.l9094-c24"},
    "church.class_change.target": {"text": "転職先：%s", "variables": ["%s"], "source_string_id": "legacy.go.remake.cmd.fd2.main.l9100-c35"},
    "common.yes": {"text": "はい", "variables": [], "source_string_id": "legacy.go.remake.cmd.fd2.main.l9101-c36"},
    "common.no": {"text": "いいえ", "variables": [], "source_string_id": "legacy.go.remake.cmd.fd2.main.l9101-c41"},
    "system.locale.changed": {"text": "言語：%s", "variables": ["%s"], "source_string_id": "runtime.settings.locale.changed"},
    "system.audio.changed": {"text": "音源：%s", "variables": ["%s"], "source_string_id": "runtime.settings.audio.changed"},
    "save.unsupported": {"text": "セーブはキャンペーンモードのみ対応しています", "variables": [], "source_string_id": "runtime.save.unsupported"},
    "save.postbattle_blocked": {"text": "戦後演出中です。次の場面でセーブしてください", "variables": [], "source_string_id": "runtime.save.postbattle_blocked"},
    "save.saved": {"text": "スロット %d にセーブしました：%s", "variables": ["%d", "%s"], "source_string_id": "runtime.save.saved"},
    "save.none": {"text": "セーブデータがありません", "variables": [], "source_string_id": "runtime.save.none"},
    "save.node_missing": {"text": "セーブ地点が見つかりません：%s", "variables": ["%s"], "source_string_id": "runtime.save.node_missing"},
    "save.loaded": {"text": "スロット %d をロードしました：%s", "variables": ["%d", "%s"], "source_string_id": "runtime.save.loaded"},
    "shop.greeting.weapon": {"text": "いらっしゃい。何が必要ですか？", "variables": [], "source_string_id": "FDTXT_000/string_0440"},
    "shop.greeting.item": {"text": "おや、買い物か？", "variables": [], "source_string_id": "FDTXT_000/string_0501"},
    "shop.purchase.question.weapon": {"text": "%sは%dゴールドです。よろしいですか？", "variables": ["%s", "%d"], "source_string_id": "FDTXT_000/string_0439"},
    "shop.purchase.question.item": {"text": "この%sは\n%dゴールドだ。買うか？", "variables": ["%s", "%d"], "source_string_id": "FDTXT_000/string_0502"},
    "shop.purchase.insufficient.weapon": {"text": "お金が足りません！", "variables": [], "source_string_id": "FDTXT_000/string_0438"},
    "shop.purchase.insufficient.item": {"text": "金が足りない！", "variables": [], "source_string_id": "FDTXT_000/string_0504"},
    "shop.purchase.no_recipient.weapon": {"text": "今の仲間には装備できる者がいません！", "variables": [], "source_string_id": "FDTXT_000/string_0437"},
    "shop.purchase.no_recipient.item": {"text": "装備できる者がいない！", "variables": [], "source_string_id": "FDTXT_000/string_0505"},
    "shop.purchase.equip_question": {"text": "装備しますか？", "variables": [], "source_string_id": "FDTXT_000/string_0507"},
    "shop.recipient.full": {"text": "%sはもう持てません！", "variables": ["%s"], "source_string_id": "FDTXT_000/string_0506"},
    "shop.transfer.destination_prompt": {"text": "誰に渡しますか？", "variables": [], "source_string_id": "FDTXT_000/string_0510"},
    "shop.transfer.empty_source": {"text": "%sは何も持っていません！", "variables": ["%s"], "source_string_id": "FDTXT_000/string_0511"},
    "shop.transfer.source_prompt": {"text": "誰の持ち物ですか？", "variables": [], "source_string_id": "FDTXT_000/string_0512"},
    "shop.purchase.success": {"text": "%sを購入(-%d G)", "variables": ["%s", "%d"], "source_string_id": "legacy.go.remake.cmd.fd2.main.l4468-c17"},
    "shop.sell.success": {"text": "アイテム%02Xhを売却(+%d G)", "variables": ["%02X", "%d"], "source_string_id": "legacy.go.remake.cmd.fd2.main.l4506-c15"},
    "shop.purchase.equip_prompt": {"text": "装備しますか？ Enter=はい、ESC=いいえ", "variables": [], "source_string_id": "legacy.go.remake.cmd.fd2.main.l4555-c15"},